<?xml version="1.0" encoding="UTF-8"?>

<resources xmlns:xsi="http://www.w3.org/2001/XMLSchema-instance" xsi:noNamespaceSchemaLocation="systemResources.xsd">
    <mainConsole/>
    <languages>
        <language id="pt_BR" default="true"/>
        <language id="en_US"/>
        <language id="es"/>
    </languages>  
    <skins>
        <skin id="default" default="true"/>
    </skins>  
    <actionForms/> 
    <services/> 
</resources>
